[
  {
    "descName": "string(STR_TRAIN_NAME_SHORT, \"TX-1000\", string(STR_NAME_SERIES))",
    "trainName": "tsukuba_1000series",
    "groupType": "semiPrivate",
    "introductionDate": "2005, 8, 24",
    "scrapYear": 0,
    "costFactor": 21,
    "runningCost": 51,
    "speed": 130,
    "trackGauge": 1067,
    "weight": [32, 31],
    "formations": [6],
    "doors": [4],
    "current": "DC_1500",
    "usage": ["express"],
    "operator": ["TSUKUBA"],
    "capacity": [{ "headCapacity": [147], "wagCapacity": [158] }],
    "power": [{ "powerPerMotor": 190, "blockLength": 8, "positions": [1, 3, 4] }]
  },
  {
    "descName": "string(STR_TRAIN_NAME_SHORT, \"TX-2000\", string(STR_NAME_SERIES))",
    "trainName": "tsukuba_2000series",
    "groupType": "semiPrivate",
    "introductionDate": "2005, 8, 24",
    "scrapYear": 0,
    "costFactor": 22,
    "runningCost": 52,
    "speed": 130,
    "trackGauge": 1067,
    "weight": [36, 34],
    "formations": [6],
    "doors": [4],
    "current": "AC_20_50hz_DC",
    "usage": ["express"],
    "operator": ["tsukuba"],
    "capacity": [{ "headCapacity": [147], "wagCapacity": [158] }],
    "power": [{ "powerPerMotor": 190, "blockLength": 8, "positions": [1, 2, 3, 4] }]
  },
  {
    "descName": "string(STR_TRAIN_NAME_SHORT, \"TX-3000\", string(STR_NAME_SERIES))",
    "trainName": "tsukuba_3000series",
    "groupType": "semiPrivate",
    "introductionDate": "2020, 3, 14",
    "scrapYear": 0,
    "costFactor": 21,
    "runningCost": 52,
    "speed": 130,
    "trackGauge": 1067,
    "weight": [37, 34],
    "formations": [6],
    "doors": [4],
    "current": "AC_20_50hz_DC",
    "usage": ["express"],
    "operator": ["tsukuba"],
    "capacity": [{ "headCapacity": [140], "wagCapacity": [151] }],
    "power": [{ "powerPerMotor": 190, "blockLength": 8, "positions": [1, 2, 3, 4] }]
  }
]
