[
  {
    "descName": "string(STR_TRAIN_NAME_LONG, string(STR_NAME_KEIO), \"1000\", string(STR_NAME_2_GEN), string(STR_NAME_SERIES),)",
    "trainName": "keio1000n",
    "groupType": "keio",
    "introductionDate": "1996, 1, 9",
    "scrapYear": 0,
    "costFactor": 20,
    "runningCost": 50,
    "speed": 110,
    "trackGauge": 1067,
    "weight": [33, 31],
    "formations": [5],
    "doors": [4],
    "current": "DC_1500",
    "usage": ["commuter"],
    "operator": ["keio"],
    "hasLiveryDesc": true
  },

  {
    "descName": "string(STR_TRAIN_NAME, string(STR_NAME_KEIO), \"5000~5100\", string(STR_NAME_SERIES),)",
    "trainName": "keio5000",
    "groupType": "keio",
    "introductionDate": "1963, 8, 4",
    "scrapYear": 2004,
    "costFactor": 20,
    "runningCost": 50,
    "speed": 105,
    "trackGauge": 1372,
    "weight": [33, 32],
    "formations": [2, 4, 5, 6, 8],
    "doors": [3],
    "current": "DC_1500",
    "usage": ["commuter"],
    "operator": ["keio"]
  },
  {
    "descName": "string(STR_TRAIN_NAME, string(STR_NAME_KEIO), \"6000\", string(STR_NAME_SERIES),)",
    "trainName": "keio6000",
    "groupType": "keio",
    "introductionDate": "1972, 5, 23",
    "scrapYear": 2011,
    "costFactor": 20,
    "runningCost": 50,
    "speed": 120,
    "trackGauge": 1372,
    "weight": [33, 31],
    "formations": [2, 3, 4, 5, 6, 8],
    "doors": [4],
    "current": "DC_1500",
    "usage": ["access_commuter"],
    "operator": ["keio"]
  },
  {
    "descName": "string(STR_TRAIN_NAME, string(STR_NAME_KEIO), \"7000\", string(STR_NAME_SERIES),)",
    "trainName": "keio7000",
    "groupType": "keio",
    "introductionDate": "1984, 3, 12",
    "scrapYear": 0,
    "costFactor": 20,
    "runningCost": 50,
    "speed": 120,
    "trackGauge": 1372,
    "weight": [33, 31],
    "formations": [2, 4, 5, 6, 8, 10],
    "doors": [4],
    "current": "DC_1500",
    "usage": ["commuter"],
    "operator": ["keio"]
  },
  {
    "descName": "string(STR_TRAIN_NAME, string(STR_NAME_KEIO), \"8000\", string(STR_NAME_SERIES),)",
    "trainName": "keio8000",
    "groupType": "keio",
    "introductionDate": "1992, 3, 1",
    "scrapYear": 0,
    "costFactor": 21,
    "runningCost": 51,
    "speed": 120,
    "trackGauge": 1372,
    "weight": [33, 31],
    "formations": [4, 6, 8, 10],
    "doors": [4],
    "current": "DC_1500",
    "usage": ["commuter"],
    "operator": ["keio"]
  },
  {
    "descName": "string(STR_TRAIN_NAME, string(STR_NAME_KEIO), \"9000\", string(STR_NAME_SERIES),)",
    "trainName": "keio9000",
    "groupType": "keio",
    "introductionDate": "2000, 12, 1",
    "scrapYear": 0,
    "costFactor": 21,
    "runningCost": 51,
    "speed": 120,
    "trackGauge": 1372,
    "weight": [33, 31],
    "formations": [8, 10],
    "doors": [4],
    "current": "DC_1500",
    "usage": ["access_commuter"],
    "operator": ["keio"]
  },
  {
    "descName": "string(STR_TRAIN_NAME_LONG, string(STR_NAME_KEIO), \"5000\", string(STR_NAME_2_GEN), string(STR_NAME_SERIES),)",
    "trainName": "keio5000n",
    "groupType": "keio",
    "introductionDate": "2017, 9, 29",
    "scrapYear": 0,
    "costFactor": 22,
    "runningCost": 52,
    "speed": 130,
    "trackGauge": 1372,
    "weight": [33, 31],
    "formations": [10],
    "doors": [4],
    "current": "DC_1500",
    "usage": ["access_commuter"],
    "operator": ["keio"]
  },
  {
    "descName": "string(STR_TRAIN_NAME_LONG, string(STR_NAME_KEIO), \"2000\", string(STR_NAME_2_GEN), string(STR_NAME_SERIES),)",
    "trainName": "keio2000n",
    "groupType": "keio",
    "introductionDate": "2026, 1, 31",
    "scrapYear": 0,
    "costFactor": 22,
    "runningCost": 52,
    "speed": 130,
    "trackGauge": 1372,
    "weight": [30.5, 30],
    "formations": [10],
    "doors": [4],
    "current": "DC_1500",
    "usage": ["commuter"],
    "operator": ["keio"]
  }
]
