[
  {
    "descName": "string(STR_TRAIN_NAME, string(STR_NAME_SEMBOKU), \"100\", string(STR_NAME_SERIES))",
    "trainName": "semboku100",
    "groupType": "nankai",
    "introductionDate": "1971, 4, 1",
    "scrapYear": 2000,
    "costFactor": 18,
    "runningCost": 48,
    "speed": 100,
    "trackGauge": 1067,
    "weight": [24, 24],
    "formations": [2, 4, 6],
    "doors": [4],
    "current": "DC_1500",
    "usage": ["commuter"],
    "operator": ["semboku"],
    "hasLiveryDesc": true
  },
  {
    "descName": "string(STR_TRAIN_NAME, string(STR_NAME_NANKAI_SEMBOKU), \"3000\", string(STR_NAME_SERIES))",
    "trainName": "semboku3000",
    "groupType": "nankai",
    "introductionDate": "1975, 3, 25",
    "scrapYear": 2006,
    "costFactor": 19,
    "runningCost": 49,
    "speed": 110,
    "trackGauge": 1067,
    "weight": [24, 24],
    "formations": [2, 4, 6, 8],
    "doors": [4],
    "current": "DC_1500",
    "usage": ["commuter"],
    "operator": ["semboku"],
    "hasLiveryDesc": true
  }
]
