[
  {
    "descName": "string(STR_TRAIN_NAME, string(STR_NAME_KINTETSU), \"800/880\", string(STR_NAME_SERIES))",
    "trainName": "kintetsu800",
    "groupType": "kintetsu",
    "introductionDate": "1955, 3, 1",
    "scrapYear": 1992,
    "costFactor": 19,
    "runningCost": 49,
    "speed": 105,
    "trackGauge": 1435,
    "weight": [36, 36],
    "formations": [3, 4],
    "doors": [2],
    "current": "DC_1500",
    "usage": ["express"],
    "operator": ["kintetsu"],
    "hasLiveryDesc": true
  },
  {
    "descName": "string(STR_TRAIN_NAME, string(STR_NAME_KINTETSU), \"1460/6441\", string(STR_NAME_SERIES))",
    "trainName": "kintetsu1460",
    "groupType": "kintetsu",
    "introductionDate": "1957, 3, 1",
    "scrapYear": 1987,
    "costFactor": 19,
    "runningCost": 49,
    "speed": 105,
    "trackGauge": 1435,
    "weight": [36, 36],
    "formations": [2, 3],
    "doors": [3],
    "current": "DC_1500",
    "usage": ["commuter"],
    "operator": ["kintetsu"],
    "hasLiveryDesc": true
  },
  {
    "descName": "string(STR_TRAIN_NAME, string(STR_NAME_KINTETSU), \"1600\", string(STR_NAME_SERIES))",
    "trainName": "kintetsu1600",
    "groupType": "kintetsu",
    "introductionDate": "1959, 3, 1",
    "scrapYear": 1988,
    "costFactor": 19,
    "runningCost": 49,
    "speed": 105,
    "trackGauge": 1435,
    "weight": [36, 36],
    "formations": [2, 4],
    "doors": [4],
    "current": "DC_1500",
    "usage": ["commuter"],
    "operator": ["kintetsu"],
    "hasLiveryDesc": true
  },
  {
    "descName": "string(STR_TRAIN_NAME, string(STR_NAME_KINTETSU), \"900\", string(STR_NAME_SERIES))",
    "trainName": "kintetsu900",
    "groupType": "kintetsu",
    "introductionDate": "1961, 9, 21",
    "scrapYear": 2001,
    "costFactor": 19,
    "runningCost": 49,
    "speed": 105,
    "trackGauge": 1435,
    "weight": [36, 36],
    "formations": [2, 3],
    "doors": [4],
    "current": "DC_1500",
    "usage": ["commuter"],
    "operator": ["kintetsu"],
    "hasLiveryDesc": true
  },
  {
    "descName": "string(STR_TRAIN_NAME, string(STR_NAME_KINTETSU), \"8000-8800\", string(STR_NAME_SERIES))",
    "trainName": "kintetsu8000",
    "groupType": "kintetsu",
    "introductionDate": "1964, 7, 1",
    "scrapYear": 0,
    "costFactor": 19,
    "runningCost": 49,
    "speed": 105,
    "trackGauge": 1435,
    "weight": [36, 36],
    "formations": [2, 3, 4, 6],
    "doors": [4],
    "current": "DC_1500",
    "usage": ["commuter"],
    "operator": ["kintetsu"],
    "hasLiveryDesc": true
  },
  {
    "descName": "string(STR_TRAIN_NAME, string(STR_NAME_KINTETSU), \"2600/2610/2000/2680\", string(STR_NAME_SERIES))",
    "trainName": "kintetsu2400",
    "groupType": "kintetsu",
    "introductionDate": "1966, 10, 1",
    "scrapYear": 1998,
    "costFactor": 19,
    "runningCost": 49,
    "speed": 105,
    "trackGauge": 1435,
    "weight": [36, 36],
    "formations": [2, 4],
    "doors": [4],
    "current": "DC_1500",
    "usage": ["commuter"],
    "operator": ["kintetsu"],
    "hasLiveryDesc": true
  },
  {
    "descName": "string(STR_TRAIN_NAME, string(STR_NAME_KINTETSU), \"8810/9000/9200/1400/1200/1420/2050/1422/1430\", string(STR_NAME_SERIES))",
    "trainName": "kintetsu9000",
    "groupType": "kintetsu",
    "introductionDate": "1982, 2, 1",
    "scrapYear": 0,
    "costFactor": 20,
    "runningCost": 50,
    "speed": 110,
    "trackGauge": 1435,
    "weight": [36, 36],
    "formations": [2, 4, 6],
    "doors": [4],
    "current": "DC_1500",
    "usage": ["commuter"],
    "operator": ["kintetsu"]
  },
  {
    "descName": "string(STR_TRAIN_NAME, string(STR_NAME_KINTETSU), \"3000\", string(STR_NAME_SERIES))",
    "trainName": "kintetsu3000",
    "groupType": "kintetsu",
    "introductionDate": "1978, 4, 1",
    "scrapYear": 0,
    "costFactor": 19,
    "runningCost": 49,
    "speed": 110,
    "trackGauge": 1435,
    "weight": [38, 38],
    "formations": [4],
    "doors": [4],
    "current": "DC_1500",
    "usage": ["access_commuter"],
    "operator": ["kintetsu"]
  },
  {
    "descName": "string(STR_TRAIN_NAME, string(STR_NAME_KINTETSU), \"3200\", string(STR_NAME_SERIES))",
    "trainName": "kintetsu3200",
    "groupType": "kintetsu",
    "introductionDate": "1986, 1, 1",
    "scrapYear": 0,
    "costFactor": 21,
    "runningCost": 51,
    "speed": 110,
    "trackGauge": 1435,
    "weight": [36, 36],
    "formations": [6],
    "doors": [4],
    "current": "DC_1500",
    "usage": ["access_commuter"],
    "operator": ["kintetsu"]
  },
  {
    "descName": "string(STR_TRAIN_NAME, string(STR_NAME_KINTETSU), \"3220\", string(STR_NAME_SERIES))",
    "trainName": "kintetsu3220",
    "groupType": "kintetsu",
    "introductionDate": "2000, 3, 1",
    "scrapYear": 0,
    "costFactor": 21,
    "runningCost": 51,
    "speed": 120,
    "trackGauge": 1435,
    "weight": [36, 36],
    "formations": [6],
    "doors": [4],
    "current": "DC_1500",
    "usage": ["access_commuter"],
    "operator": ["kintetsu"],
    "customPath": "kintetsu21"
  },
  {
    "descName": "string(STR_TRAIN_NAME, string(STR_NAME_KINTETSU), \"5820/9020/9820\", string(STR_NAME_SERIES))",
    "trainName": "kintetsu9020",
    "groupType": "kintetsu",
    "introductionDate": "2000, 4, 3",
    "scrapYear": 0,
    "costFactor": 21,
    "runningCost": 51,
    "speed": 120,
    "trackGauge": 1435,
    "weight": [36, 36],
    "formations": [2, 6],
    "doors": [4],
    "current": "DC_1500",
    "usage": ["commuter"],
    "operator": ["kintetsu"],
    "reuseCapacityFrom": "kintetsu3220",
    "reusePowerFrom": "kintetsu3220",
    "customPath": "kintetsu21"
  },
  {
    "descName": "string(STR_TRAIN_NAME, string(STR_NAME_KINTETSU), \"6820\", string(STR_NAME_SERIES))",
    "trainName": "kintetsu6820",
    "groupType": "kintetsu",
    "introductionDate": "2002, 4, 1",
    "scrapYear": 0,
    "costFactor": 21,
    "runningCost": 51,
    "speed": 100,
    "trackGauge": 1067,
    "weight": [36, 36],
    "formations": [2],
    "doors": [4],
    "current": "DC_1500",
    "usage": ["commuter"],
    "operator": ["kintetsu"],
    "reuseCapacityFrom": "kintetsu3220",
    "reusePowerFrom": "kintetsu3220",
    "customPath": "kintetsu21"
  },
  {
    "descName": "string(STR_TRAIN_NAME, string(STR_NAME_KINTETSU), \"8A\", string(STR_NAME_SERIES))",
    "trainName": "kintetsu8a",
    "groupType": "kintetsu",
    "introductionDate": "2024, 10, 7",
    "scrapYear": 0,
    "costFactor": 22,
    "runningCost": 52,
    "speed": 120,
    "trackGauge": 1435,
    "weight": [35, 34],
    "formations": [4],
    "doors": [4],
    "current": "DC_1500",
    "usage": ["commuter"],
    "operator": ["kintetsu"],
    "customPath": "kintetsu1a"
  },
  {
    "descName": "string(STR_TRAIN_NAME, string(STR_NAME_KINTETSU), \"6A\", string(STR_NAME_SERIES))",
    "trainName": "kintetsu6a",
    "groupType": "kintetsu",
    "introductionDate": "2026, 5, 19",
    "scrapYear": 0,
    "costFactor": 22,
    "runningCost": 52,
    "speed": 120,
    "trackGauge": 1067,
    "weight": [35, 34],
    "formations": [4],
    "doors": [4],
    "current": "DC_1500",
    "usage": ["commuter"],
    "operator": ["kintetsu"],
    "reusePowerFrom": "kintetsu8a",
    "reuseCapacityFrom": "kintetsu8a",
    "reuseGfx": "kintetsu8a",
    "customPath": "kintetsu1a"
  },
  {
    "descName": "string(STR_TRAIN_NAME, string(STR_NAME_KINTETSU), \"1A/1B\", string(STR_NAME_SERIES))",
    "trainName": "kintetsu1a",
    "groupType": "kintetsu",
    "introductionDate": "2026, 1, 16",
    "scrapYear": 0,
    "costFactor": 22,
    "runningCost": 52,
    "speed": 120,
    "trackGauge": 1435,
    "weight": [35, 34],
    "formations": [4],
    "doors": [4],
    "current": "DC_1500",
    "usage": ["commuter"],
    "operator": ["kintetsu"],
    "reusePowerFrom": "kintetsu8a",
    "reuseCapacityFrom": "kintetsu8a"
  }
]
