[
  {
    "descName": "string(STR_TRAIN_NAME, string(STR_NAME_TWR), \"70-000\", string(STR_NAME_TYPE))",
    "trainName": "twr_70_000series",
    "groupType": "semiPrivate",
    "introductionDate": "1996, 03, 30",
    "scrapYear": 0,
    "costFactor": 18,
    "runningCost": 48,

    "speed": 110,
    "trackGauge": 1067,
    "weight": [34, 34],
    "formations": [4, 6, 10],
    "doors": [4],
    "current": "DC_1500",
    "usage": ["commuter"],
    "operator": ["twr"],

    "capacity": [
      {
        "headCapacity": [146],
        "wagCapacity": [156]
      }
    ],
    "power": [{ "powerPerMotor": 95, "blockLength": 3, "positions": [2, 3] }]
  }
]
