[
  {
    "descName": "string(STR_TRAIN_NAME, string(STR_NAME_NANKAI), \"6200\", string(STR_NAME_SERIES))",
    "trainName": "nankai6200",
    "groupType": "nankai",
    "introductionDate": "1974, 11, 22",
    "scrapYear": 0,
    "costFactor": 19,
    "runningCost": 49,
    "speed": 110,
    "trackGauge": 1067,
    "weight": [34, 34],
    "formations": [4, 6],
    "doors": [4],
    "current": "DC_1500",
    "usage": ["commuter"],
    "operator": ["nankai"]
  },
  {
    "descName": "string(STR_TRAIN_NAME, string(STR_NAME_NANKAI), \"8200\", string(STR_NAME_SERIES))",
    "trainName": "nankai8200",
    "groupType": "nankai",
    "introductionDate": "1983, 03, 10",
    "scrapYear": 2015,
    "costFactor": 19,
    "runningCost": 49,
    "speed": 115,
    "trackGauge": 1067,
    "weight": [34, 34],
    "formations": [6],
    "doors": [4],
    "current": "DC_1500",
    "usage": ["commuter"],
    "operator": ["nankai"]
  }
]
